,job_title,company_name,location,post_date,job_description,salary
114,Inventory Analyst,PT Oil States Indonesia,"Batam, Riau Islands",Posted 21h ago,"About us
With a strong track record of supporting customer success for over 75 years, Oil States Industries is a technology-focused and major global provider of integrated energy systems & solutions to oil and natural gas markets. At Oil States Industries, we cultivate a culture that recognizes our employees are our greatest asset. Together, we focus on innovation, teamwork, and our commitments to our customers. Our People embrace mutual respect, ethical behavior, and work-life balance in our relentless pursuit for growth, diversity as well as high standards in safety, quality, and performance. We now have an exciting career opportunity for an aspiring individual to make an impact, develop your capabilities and unleash your potential with Oil State Industries as an Inventory Analyst. This position will be based in Batam, Indonesia.
Responsibilities:
1.Responsible for accounting, control, and analysis of inventory
2.Develop, implements, and maintains appropriate procedures, processes, and systems to ensure inventory accounting is accomplished efficiently and timely.  Execute continuously improvements on stock control system for all locations.
3.Reconcile and review inventory sub ledger against general ledger and identify and investigate variances
4.Execute weekly cycle counting, co-ordinate with all respective departments and overseas locations for physical inventory counts, maintain strict records, reconcile discrepancies, and report inventory accuracy (by value and quantity) on a weekly basis.
5.Responsible for the annual year end physical inventory count and assist with the reconciliation of the physical inventory count to the book numbers. Co-ordinate stock recounts as needed.
6.Conduct training for all employees involved in cycle & annual physical inventory counts as well as inventory control.
7.Review and approve all material movement for all locations.
8.Review with sales and project team on open work orders on a monthly basis.
9.Close work orders and ensure all costs are accurate and complete.
10.Assist in reviewing the WIP vs Backlog report monthly.
11.Perform GRN for all service-related purchase orders
12.Supervise all physical GRN.
13.Assist in SOX audit and external audits.
Qualification:
•Minimum diploma qualification or with relevant years of experience.
•Minimum 3 years inventory control and basic accounting experience.
•Computer literate with knowledge of Microsoft Applications (Excel, Word).
•Excellent organizational and analytical skills.
•Good written and verbal english communication skills.",Not Available
115,Business Financial Analyst,PT Citra Tubindo Tbk,"Batam Kota, Riau Islands",Posted 7d ago,"About the Role
Support strategic and operational decision-making by providing accurate and timely business performance analysis, while ensuring compliance with global company policies and standards.
Key Responsibilities
Monitor and report key financial and operational performance indicators for SSC operations.
Analyze variances and support performance improvement initiatives across functional teams.
Facilitate budgeting and forecasting processes in coordination with business units.
Maintain dashboards and management reports to support decision-making.
Participate in digitalization and automation projects to improve business reporting and efficiency.
Contribute to annual budgeting and business forecasting.
Review CAPEX & OPEX and deliver actionable cost-efficiency insights.
Execute data extraction and cleansing from ERP systems (e.g., SAP).
Conduct benchmarking across plants or business units.
Perform root cause analysis on performance deviations.
Prepare management review materials and performance meeting content.
Initiate and monitor data-driven improvement projects.
Requirements
Bachelor's degree in Business, Engineering, or related field
Fluent in English; additional languages (e.g., Bahasa Indonesia, Mandarin) are a plus
3+ years in business performance, operations, or shared services roles in a manufacturing environment
Hands-on experience with ERP systems
Skilled in Excel and Power BI for dashboards, performance scorecards, and trend reporting
Competence in handling digital documentation and automated workflows
What We're Looking For
Proficient in finance service workflows
Analytical thinking for performance measurement, root-cause analysis, and variance reporting
Effective communication across departments and hierarchical levels
Attention to detail and accuracy
Strong time management and prioritization skills in handling multi-stream service requests
Critical attention to data accuracy and reporting integrity
Problem-solving mindset with an eye for process simplification and automation opportunities
Why Join Us
Opportunity to drive strategic talent initiatives
Exposure to organizational development and leadership programs
Collaborative and growth-oriented environment",Not Available
116,CRM Analyst (Customer Relationship Management),PT Lautan Luas Tbk,"West Jakarta, Jakarta",Posted 28d ago,"Job Description :
- Manage and maintain sales & customer data within the CRM system.
- Prepare periodic reports and ensure data accuracy & consistency.
- Analyze data to support sales performance and business decisions.
- Support CRM system improvement and process optimization.

Requirements :
- Bachelor’s degree in Statistics, Mathematics, Data Science, or related fields.
- Minimum 2–3 years of experience in CRM, data analysis, or similar roles.
- Strong skills in data compilation and analysis.
- Proficiency in Excel or other data processing tools.
- Detail-oriented with strong analytical and communication skills.",Not Available
117,Data Analyst,Trackerindo Anugerah Sejahtera CV,"Bandung, West Java",Posted 28d ago,"KUALIFIKASI:
Pendidikan minimal S1 di bidang Matematika, Statistika, atau jurusan terkait.
Memiliki pengalaman minimal 1–2 tahun di bidang retail analyst, merchandise analyst, inventory analyst, atau posisi terkait menjadi nilai tambah.
Menguasai Microsoft Excel (Pivot Table, VLOOKUP/XLOOKUP, IF, SUMIFS, dan formula analisa lainnya).
Memiliki kemampuan problem solving dan analytical thinking yang baik.
Mampu bekerja dengan deadline dan menangani beberapa laporan sekaligus.
Teliti, terorganisir, dan memiliki kemampuan follow-up yang baik.
Terbiasa bekerja sama dengan banyak divisi seperti showroom, gudang, dan produksi.

JOBDESC:
Mengumpulkan, mengolah, dan memperbarui data penjualan showroom secara berkala (harian, mingguan, dan bulanan).
Melakukan analisis data penjualan untuk menentukan kebutuhan produksi dan membuat RO (Repeat Order) bulanan.
Membuat analisis serta laporan kebutuhan produksi berdasarkan tren penjualan dan performa produk.
Melakukan update weekly income dan perencanaan penjualan/store performance.
Menganalisis performa produk best seller, slow moving, dan produk baru.
Membuat review dan evaluasi produk baru satu bulan setelah distribusi ke showroom/store.
Membuat dan menganalisa data RO per semester sesuai kebutuhan perusahaan.
Melakukan analisis item dan assortment produk untuk pembukaan showroom/store baru.
Memastikan akurasi data stock antara gudang dan showroom.
Membuat laporan analisa penjualan, stock, dan performa produk secara berkala.
Memberikan rekomendasi berdasarkan hasil analisa data untuk meningkatkan penjualan dan efektivitas distribusi barang.
Berkoordinasi dengan tim showroom, gudang, produksi, dan purchasing terkait kebutuhan data dan distribusi barang.
Menangani kebutuhan data adhoc dari management atau departemen terkait.",Rp 3.700.000 – Rp 4.200.000 per month
118,Data Engineering Intern,Danone Indonesia,"South Jakarta, Jakarta",Posted 2d ago,"✨ Danone Indonesia is looking for a Data Engineering Intern to join our IT & Data Team!
Kickstart your career in a dynamic environment and gain hands-on experience at our Head Office.
Key Responsibilities:
Analyze and enhance existing Power BI dashboards and reports
Modify and improve data visualization to support business needs
Develop new dashboard mock-ups and reporting solutions
Integrate Power BI with SQL databases using SQL Query and Power Query
Work on assigned projects with the Operations team, including real business use cases
Requirements:
Undergraduate student in Data Engineering, Data Science, Computer Science, or related field
Proficient in SQL Query and Power BI (mandatory)
Experience in data visualization and dashboard creation
Familiar with Microsoft Excel (e.g., VLOOKUP, data processing)
Knowledge of Excel Macros/VBA is an advantage
Strong analytical thinking and attention to detail
Willing to be placed at Danone Indonesia HO - RDTX (Hybrid 4 WFO & 1 WFH).
If you’re interested or know someone who fits this role, apply now and be part of our IT & Data Team!",Not Available
119,DATABASE ADMINISTRATOR,PT Jasuindo Tiga Perkasa Tbk,"Sidoarjo, East Java",Posted 3d ago,"Sasaran Jabatan:
Merancang dan memelihara database informasi perusahaan melalui proses analisa, instalasi, konfigurasi, optimalisasi agar mampu beroperasi optimal guna mendukung operasional perusahaan.

Uraian Tugas: 
Melakukan proses instalasi, setup, konfigurasi dan management database server dalam ruang lingkup kebutuhan perusahaan.
Membuat perencanaan terkait sistem keamanan database informasi perusahaan untuk melindungi data dan informasi dari kerusakan akibat serangan virus, mallware, dll termasuk kerusakan perangkat fisik media penyimpanan.
Melakukan analisa monitoring trafik dan penambahan volume database server dan juga data file server (capacity management).
Melakukan pencatatan ketidaksesuaian yang terjadi untuk dianalisa datanya dan dicari solusi atas ketidaksesuaian tersebut.
Melakukan optimalisasi database dan informasi perusahaan untuk menjaga kualitas layanan perusahaan dari sisi Teknologi Informasi.
Melakukan review berkala terhadap hak akses dari masing-masing user sesuai perencanaan dari bagian Information System terkait akses ke database dan dari bagian System Administrator terkait akses ke informasi perusahaan.
Menjamin keamanan data dan informasi yang meliputi Data-Authorization dan Data-Recovery terhadap pihak-pihak yang tidak berkepentingan atau kondisi-kondisi yang tidak diharapkan dengan cara melakukan prosedur backup secara teratur.
Membuat laporan secara berkala tentang kondisi database dan informasi perusahaan.
Memastikan proses Backup dan Restore terhadap database dan informasi perusahaan berjalan sesuai prosedur dan sudah dilakukan pengujian secara berkala akan keberhasilan proses backup maupun restore nya.
Spesifikasi Pekerja: 
S1 Teknik Informatika.
Berpengalaman di bidang Database Administrator minimal 3 tahun. 
Memiliki pengetahuan dan pemahaman tentang Enterprise Database (Oracle, SQL Server, Postgree, mySQL).
Memiliki pengetahuan dan pemahaman terkait Oracle Cloud Infrastructure, manajemen RDMS, dan Server Operating System (windows, server, linux).
Memiliki pemahaman dan penguasaan programming berbasis SQL.
Memiliki kemampuan analisa yang detail dan akurat.
Memiliki kemampuan bahasa inggris yang baik dalam lisan maupun tertulis.
Bersedia menjalani proses seleksi, tes serta penempatan kerja di SIDOARJO - JAWA TIMUR.",Not Available
120,Data Engineer,PT ROCKSTAR SPORTS SCHOOL,"West Jakarta, Jakarta",Posted 1d ago,"Job Descriptions:
Perform data exploration, data cleaning, data imputation, and feature engineering on unstructured and structured data.
Design, Develop and maintain report used for daily operation, management and analytics
Build the infrastructure for optimal extraction, transformation, and loading (ETL) of data from a wide variety of data sources.
Develop and maintain all data flows and prepare all ETL processes according to business requirements and incorporate all business requirements into all design specifications
Identifying, designing and implementing internal process improvements including re-designing infrastructure for greater scalability, optimizing data delivery, and automating manual processes 
Build analytics tools that utilize the data pipeline to provide actionable insights
Explore ways to enhance data quality and reliability Explore ways to enhance data quality and reliability
Document all test procedures for systems and processes              

Job Requirements:
Bachelor's degree from computer science or related fields, or equivalent software engineering experience.
Advanced SQL knowledge and experience working with relational databases, query authoring (SQL). Preferably on MS SQL
Advanced Knowledge in reporting service tools. Preferably Microsoft SSRS
Advanced Knowledge in ETL / data pipeline applications. Preferably Microsoft SSIS.
Experienced in performing root cause analysis on internal and external data and processes to answer specific business questions and identify opportunities for improvement.
Have an understanding and experience regarding the reporting dashboard and data warehouse concepts
Experienced in object-oriented/object function scripting languages: Python, Java, C#,C++, 
Proficiency in source control i.e. Git.
Got 2+ years of experience in Data Engineering role.
Familiar with Azure ETL product like Azure Data Factory, Azure Synapse, Azure Datalake, Azure Devops would be a great addition.",Rp 10.000.000 – Rp 15.000.000 per month
121,Data Engineer,AME Mineral Economics Pty Ltd,"South Jakarta, Jakarta",Posted 5d ago,"Role: Data Engineer
Location: Jakarta
Position Type: Full-time
Reports to: CTO
About AME Group
AME Group is a leading provider of consulting and research services to the Metals & Mining and Coal & Consumable Fuels industries. Drawing on more than 50 years of industry expertise, we deliver bespoke consulting engagements, subscription research, and software-as-a-service products to clients globally.
About the Role
We are looking for a Data Engineer to design, implement, and maintain the reliable data pipelines that bring data into AME’s research and software products. You will collect and process data from a range of public APIs into a centralized blob storage and database environment, ensuring it is ingested efficiently, transformed cleanly, and made accessible for downstream analysis and reporting.
This role works hands-on with Python-based ETL pipelines, workflow orchestration in Apache Airflow (our data orchestration platform), and cloud storage on Azure. You will work closely with our research team, data scientists, and software developers to make sure the data they depend on is available, accurate, and usable.
A significant part of this role involves managing geospatial data, so you will also work with GIS datasets in Microsoft SQL Server and ArcGIS Server alongside the core pipeline work.
A Data Engineer is primarily responsible for:
Designing and maintaining the ETL/ELT pipelines that ingest data from public APIs into blob storage and relational databases
Keeping those pipelines reliable through monitoring, logging, and validation
Structuring and transforming data so it is ready for downstream analysis, reporting, and web applications
Managing and maintaining geospatial (GIS) datasets within our SQL Server and ArcGIS Server environment
Documenting data sources, transformations, and orchestration logic clearly
Key Responsibilities
Design and implement robust ETL/ELT pipelines to extract data from multiple public APIs and load it into blob storage and relational databases
Build and manage scheduled workflows in Apache Airflow, our data orchestration platform
Handle complex API integrations, including authentication flows (OAuth2, API keys), pagination, and rate limiting
Structure data in blob storage (e.g. Azure Blob) for efficient downstream access
Transform and load data into structured SQL databases for analytics and access by web applications
Manage and maintain geospatial (GIS) data in Microsoft SQL Server and ArcGIS Server, ensuring it is accurate and accessible to downstream applications
Implement monitoring, logging, and validation to ensure data integrity and pipeline reliability
Work closely with data scientists and software developers to ensure data availability and usability
Maintain clear documentation for data sources, transformations, and orchestration logic
Qualification and Experience
This is a hands-on, production-focused data engineering role. You will spend your time building and maintaining real pipelines that the business depends on, working directly with code, APIs, and cloud infrastructure rather than through managed, no-code tooling. You do not need a background in our industry. However, candidates looking for a purely analytical or reporting role, or who are not comfortable writing production code and working with version control and the command line, will not be progressed.
Required
Bachelor’s degree in Computer Science, Data Engineering, or a related field (or equivalent practical experience)
3+ years building data pipelines in a production environment
Strong understanding of ETL/ELT architecture, API data ingestion, and data modeling principles
Hands-on experience with Azure
Experience working with geospatial/GIS data in Microsoft SQL Server and ArcGIS Server
Clear communication, including explaining technical concepts to non-technical stakeholders
A naturally analytical, detail-oriented mindset with a proactive approach to monitoring and data accuracy
Highly Desirable
Experience integrating data from open economic and financial APIs (e.g. World Bank, IMF, OECD, UN Data, FRED)
Familiarity with large structured and semi-structured datasets (JSON, CSV, Parquet) and associated performance considerations
Experience building incremental ingestion or change data capture (CDC) pipelines
An interest in, or exposure to, the resources, commodities, or research data domain
Technical Skills
Languages: Python and SQL (Microsoft T-SQL)
Orchestration: Apache Airflow
Geospatial: GIS data in Microsoft SQL Server and ArcGIS Server
RESTful API integration (authentication, pagination, error handling)
Azure Blob Storage
Familiarity with version control (Git) and CI/CD pipelines
Fluent written and spoken English (essential)
What We Offer
Modern, central office near to public transport and key amenities
Competitive salary
Health Care
Lunch
13 months salary",Not Available
122,Data Engineer,FKS Group,"Tangerang, Banten",Posted 18d ago,"Placement : Cikokol, Tangerang.
Level : Sr Supervisor

Requirements:
Minimum bachelor degree of any major
Minimum 5 years working experience in related field
Experienced in using SQL / PostgreSQL or similar tools
Experienced in SSIS / Airflow / Cloudera / Alteryx / Informatica / Snowflake or similar tools
Proven experience in consolidating multiple data sources into data warehouse / data marts
Proven experience in developing data pipeline and maintaining ETL tools
Good understanding of data engineering and data modeling concepts

Job Description:
Perform end-to-end data warehouse development
Design customer data structure to allow the program to be used for multiple entities under the same platform
Create functional design documents to ensure developers works and builds in efficient way
Developing and maintaining databases, data systems - reorganizing data in readable format
Develop and applies analytical algorithms and methods where possible with a view of driving and enhancing data systems and streamlining business processes.",Not Available
123,IT Consultant (Data Scientist/Engineer),PT. IDX CONSULTING,Jakarta,Posted 9d ago,"Description
id/x partners provides consulting services specializing in Data, Analytics, and Decisioning solutions. We help organizations leverage data-driven insights, advanced analytics, and modern data platforms to optimize business performance, risk management, and operational efficiency.
As an IT Consultant (Data Scientist / Data Engineer), you will have the opportunity to work on various client projects, helping organizations transform raw data into valuable business insights and scalable data solutions. You will collaborate with multidisciplinary teams to solve complex business challenges through data engineering, analytics, and machine learning technologies.
Responsibilities
Work within project teams to solve data-related challenges, including data quality, integration, transformation, and analytics.
Design, develop, and maintain ETL/ELT processes and data pipelines.
Build and optimize data structures, databases, and data warehouses based on business and product requirements.
Analyze large datasets to identify trends, patterns, and actionable insights.
Develop, implement, and optimize machine learning and analytical models to support business objectives.
Perform data validation, query testing, and data quality assurance to ensure accuracy and reliability.
Collaborate with business users, project managers, and technical teams to gather requirements and deliver data-driven solutions.
Define best practices for data migration, conversion, and governance.
Support project implementation, deployment, and continuous improvement initiatives.
Research and evaluate emerging technologies, tools, and methodologies related to Data Engineering and Data Science.
Requirements
Bachelor's Degree in Computer Science, Information Systems, Informatics, Statistics, Mathematics, Engineering, or related fields.
Minimum 2 years of experience in Data Engineering, Data Science, Data Analytics, or related fields.
Experience in Banking, Financial Services, Insurance, or Consulting industries is preferred.
Proficiency in SQL and Python.
Experience in at least one of the following areas:
Data Engineering: ETL/ELT, Data Warehouse, Data Modeling, Data Integration, Big Data Processing.
Data Science: Machine Learning, Statistical Analysis, Predictive Modeling, MLOps, Data Visualization.
Experience with data integration tools such as SSIS, Talend, DataStage, or similar technologies.
Familiarity with Big Data technologies such as Spark, Hadoop, Cloudera, or equivalent platforms is an advantage.
Strong analytical thinking and problem-solving skills.
Data-oriented mindset with a passion for working with large-scale data.
Positive attitude, self-motivated, and able to work effectively both independently and within teams.
Excellent verbal and written communication skills.
Comfortable working directly with clients and collaborating across multiple project stakeholders.",Not Available
124,Engineer Data Center,PT GCI Indonesia,Jakarta,Posted 2d ago,"Data Center Engineer bertanggung jawab penuh atas instalasi, pemeliharaan, pemantauan, dan pemecahan masalah (troubleshooting) seluruh komponen infrastruktur fisik dan logis di dalam Data Center. Fokus utama posisi ini adalah memastikan ketersediaan tinggi (high availability), keamanan fisik, efisiensi energi, dan keandalan sistem agar seluruh operasional bisnis perusahaan berjalan tanpa gangguan (zero downtime).
Termasuk manajemen dan pemeliharaan Fasilitas Fisik (UPS, Genset, PDU, PAC, CCTV) dan Operasional IT (install/swap/replace server, storage, rack, cabling, mainboard hingga Asset.",Not Available
125,Data Center IT Engineer,TITANICOM TECH LIMITED,Jakarta,Posted 8d ago,"Job description
Job Responsibilities:
Install, configure, maintain, and troubleshoot servers, storage systems, and networking hardware (e.g., routers, switches, firewalls).
Perform physical tasks such as racking, stacking, cabling, and hardware replacements.
Monitor and manage environmental controls (temperature, humidity, airflow) to ensure optimal data center performance.
Perform regular equipment inspections and preventive maintenance.
Respond to and resolve support tickets related to hardware and network issues in a timely manner.
Manage asset inventory and maintain detailed documentation of infrastructure, cabling layout, and equipment tracking.
Work closely with network and systems teams to support infrastructure upgrades, migrations, and incident resolution.
Ensure compliance with security protocols, safety standards, and company policies.
Participate in 24/7 shift rotation and on-call support schedule as required.
Collaborate with vendors and service providers for hardware support and facility-related work.


Basic Job Requirement:
Have 1 year experience
Degree in a computer-related field.
Strong communication skills, responsible, able to handle work pressure, and a team player.",Not Available
